{
  "id": "0f7a1f43-ec21-46f7-a27a-5ad45c2ef200",
  "createdAt": "2026-05-17T19:50:00.000Z",
  "capturedAt": "2026-05-17T13:37:00.000Z",
  "capturedAtSource": "manual",
  "tag": "water_quality",
  "tags": [
    "water_quality",
    "sanitation"
  ],
  "district": "Hodan",
  "city": "Mogadishu",
  "note": "Highly turbid and discolored water observed.",
  "lat": "2.0469",
  "lon": "45.3182",
  "analysis": {
    "summary": "Highly turbid standing water is visible near a public access area, with sanitation and health-risk concerns.",
    "severity": "high",
    "category": "water_quality",
    "categories": [
      "water_quality",
      "sanitation",
      "health_risk"
    ],
    "observedIssues": [
      "Water appears highly turbid or discolored.",
      "Standing water may indicate poor drainage or contamination risk.",
      "Scene may affect people collecting or using nearby water."
    ],
    "recommendedActions": [
      "Mark the report for same-day field review.",
      "Collect a water quality sample if safe and available.",
      "Check whether sanitation runoff or drainage is entering the water source.",
      "Advise local users not to drink untreated water until reviewed."
    ],
    "needsEscalation": true,
    "confidence": 0.78
  }
}
